{
  "$schema": "../schemas/pi-workflows.schema.json",
  "version": 1,
  "project": {
    "name": "node-service",
    "kind": "package",
    "root": ".",
    "packageManager": "pnpm",
    "primaryLanguages": ["typescript", "javascript"]
  },
  "commands": {
    "test": { "cmd": "pnpm test", "source": "package.json:scripts.test", "confidence": "verified" },
    "testFocused": { "cmd": "pnpm test -- --runInBand path/to/focused.test.ts", "source": "operator", "confidence": "inferred" },
    "typecheck": { "cmd": "pnpm run typecheck", "source": "package.json:scripts.typecheck", "confidence": "verified" },
    "lint": { "cmd": "pnpm run lint", "source": "package.json:scripts.lint", "confidence": "verified" },
    "build": { "cmd": "pnpm run build", "source": "package.json:scripts.build", "confidence": "verified" }
  },
  "gates": {
    "preflight": { "description": "Baseline repo state checks before editing.", "commands": [], "required": false, "allowEmpty": true },
    "focused": { "description": "Narrow verification for the active slice.", "commands": ["testFocused"], "required": false },
    "beforeCommit": { "description": "Checks required before committing.", "commands": ["typecheck", "lint", "test"], "required": true },
    "final": { "description": "Strongest practical final verification.", "commands": ["build", "test"], "required": true }
  },
  "rules": {
    "requirePlanForMultiFileChanges": true,
    "requireReviewBeforeCommit": true,
    "requireAdversarialReviewAfterEveryTask": true,
    "oneWriter": true,
    "commitPolicy": "plan",
    "allowedSubagents": ["scout", "planner", "worker", "reviewer", "oracle"],
    "stopOn": ["dirty-overlap", "unknown-command", "failed-gate", "review-failed", "unapproved-dependency-change", "external-side-effect"]
  },
  "artifacts": { "plansDir": ".pi/plans", "runsDir": ".pi/runs", "agentInstructions": "AGENTS.md" },
  "ownership": { "highRiskPaths": ["infra/**", ".github/workflows/**"], "generatedPaths": ["dist/**"], "lockfiles": ["package-lock.json", "pnpm-lock.yaml", "yarn.lock", "bun.lockb"] },
  "notes": ["Copy to .pi/workflows.json and verify every command before trusting required gates."]
}
